<?xml version="1.0" encoding="UTF-8"?>
<!DOCTYPE  Student[
    <!ELEMENT Student (name,age,class,fees)>
    <!ELEMENT name (#PCDATA)>
    <!ELEMENT age (#PCDATA)>
    <!ELEMENT class (#PCDATA)>
    <!ELEMENT fees (#PCDATA)>
]>
<Student>
    <name>ali</name>
    <age>23</age>
    <class>9</class>
    <fees>1000</fees>
</Student>
    
